,press,title,date
0,한국경제,"[[""코로나 뚫은 제조업…'1조 클럽' 사상 최다"", '[단독] 양도세 장기보유공제 축소…주택 신규 취득자만 적용', '1년새 1~2%P 뛴 신용대출 금리', '화이자·모더나, EU에 공급할 백신 가격 인상', '1명이 8명 감염…델타 변이, 수두만큼 빠르게 전파'], ['[이 아침의 시] 나비가 날아오르는 시간 - 김용택(1948~)', ""7월 수출 '서프라이즈'…한국 무역 65년 만에 최대"", '연간 수출액 신기록도 경신할까…델타 변이에 달렸다'], [""'슈퍼사이클' 탄 제조업…선제투자·新사업·구조조정 '3박자' 통했다"", ""제조업 '효자' 덕에 웃는 지주사들…SK·GS·두산·현대重도 '1조 클럽'"", '""올해가 피크아웃"" vs ""체질 강해져 호황 지속""…하반기 실적전망은 엇갈려'], ['[단독] \'稅폭탄\' 반발에 與 후퇴…주택 매수 대기자는 ""양도세 차별""', ""美·유럽 태양광 늘릴수록…中 석탄의존 가속 '친환경의 역설'"", '1인당 주거면적 9평…일본보다 좁다'], ['대출 조여 집값 잡으려는 정부…직장인들 ""앉아서 이자만 더 뜯겨""', ""주택담보대출 금리 '꿈틀'…2년 만에 최고치"", ""저축은행·농협 대출도 '고삐'…이자부담 커진다""], [""윤석열, 입당 첫 행보 '청년 앞으로'…최재형, 이태원서 '자영업자 챙기기'"", '이재명 ""민주세력 본산은 전라도"" vs 이낙연, 경기 민심 \'집중 공략\'', ""'문재인 대통령 비하' 소마 공사…日 외무성, 귀국 명령 내려"", ""'기본소득' 찬반 충돌…쪼개지는 친문"", '""올해 태어날 아이 5000만원 연금빚""', ""친윤 vs 친최 新계파 '세대결'…헤쳐모이는 국민의힘 의원들"", '통일부, 한미훈련 연기론에…軍 ""예정대로 진행될 듯""', '김여정, 한·미훈련 취소 압박…""예의주시할 것""'], ['수두만큼 전파 빠른 델타…""1명이 8명에 옮기고 치명률도 높아""', '4단계 피해 동해로 강원도 45만명 몰려…고속도로 정체 극심', '서울시, 오후 9시 이후 버스·지하철 30% 감축 검토'], [""치열해진 '탄소저감 올림픽'…LG·현대차 웃었다"", 'LG에너지솔루션 ESG 비전 발표…""2030년까지 전력 100% 재생에너지로""', '기업들 신재생에너지 쉽게 쓰는 길 열렸다', ""10조 창출한 최태원의 '新사회적 가치'"", '[모십니다] 대한민국 ESG 경영대상 민간 부문'], ['소상공인에 14.5兆 지원한다더니…정부 지급액 실제로는 12조원 그쳐', '비트코인 10일째 랠리…추가 상승엔 이견', '하나금융, 어린이집 100곳 선정 완료', ""'블루리본 컨설턴트' 19% 늘어…손보업계, 올해 2373명 선정"", '회갑 맞은 기업은행…""혁신금융 마중물 돼야""', ""공정위 '계열사 4곳 누락' SK조사 마무리""], ['빠르게 식는 中 제조업 경기…또 부양책 꺼내나', '美, 中기업 상장 심사 강화한다', 'Fed 차기 의장 거론되는 브레이너드 ""테이퍼링 서둘러선 안돼""', '머스크 ""애플 앱 수수료는 바가지 장사""', ""아마존, EU서 1조원 '과징금 폭탄'""], [""3분기 주식 맛집은 해외…이젠 '몰빵'보단 '안전빵'"", '""채권 비중 줄이되…담으려면 단기債 관심을""'], ['채찍 들고 당근 주는 中…""반도체·전기차는 무풍지대""', '전기차 질주로 리튬 수요 폭증…세계 1위 美 앨버말 주목해야'], ['\'어닝쇼크 암초\' 조선주""…증권사 ""조정을 매수 기회로""', '숨고른 효성첨단소재…""하반기 본격 실적 개선""', ""크래프톤 이어 원티드랩·한컴라이프케어…'IPO 슈퍼위크'""], ['[한상춘의 국제경제 읽기] 시진핑의 3不 정책…韓 증시, 본격 조정 빌미되나', '뉴욕증시, 7월 고용지표 발표…긴축논의 착수 갈림길', ""상하이증시, 중소기업 포함한 '차이신 PMI'도 하락세 전망""], ['리조트야, 호텔 라운지야?… ""슈퍼 리치 위한 은행 점포입니다""', ""1·2층 공적연금, 3층엔 연금저축…'은퇴 빌딩' 쌓아 노후 즐겨라"", '""대출 비교 플랫폼, 일주일에 한 번만 조회하세요""', '20대도 걸리는 만성질환, 보험으로 대비를'], ['할머니가 보내준 생활비로 주식 투자…증여세 내야할 수도', ""해외거래소, 레버리지 한도 대폭 줄여…'빚투' 줄어들까"", '업무용 車 비용명세서 안 내면 내년부터 1% 가산세'], ['""재건축 기다리느니…"" 강남·용산 이어 분당·용인 리모델링 \'바람\'', ""포천·수원·마곡…도심 '숲세권' 단지 분양 잇따라"", '""차라리 내년에""…잇단 퇴짜에 안전진단 보류 속출'], ['김승연 ""한화, 불굴의 정신으로 100년 기업 도전""', '""삼성 생태계 만들자"" TV·가전·무선 사장 뭉쳤다', 'LG유플러스, 해킹에 강한 5G 통신망 깐다', '카카오, 전화호출 대리운전 시장 진출', ""부실 털고 2년6개월치 일감 확보…조선 빅3, 이젠 '제값 받기' 사활"", ""대한항공 '화물수송 5위' 사수""], [""변방서 세계 우뚝…韓양궁·현대차는 '닮은꼴'"", '""꿈의 소재로 만든 \'위아위스\' 활…양궁 3관왕 안산 선수도 쐈죠""', ""정의선도 엄지 척…'금빛 화살' 뒤엔 현대차 이 기술 있었다""], ['편의점 CU, 와인 추천 서비스', '면세점만 쏙 빠진 백신 우선접종', '다시 집밥…롯데백화점 반찬 매출 두배 늘어', ""[단독] AI가 '작업반장'하는 정육각…네이버, 축산 혁신에 꽂혔다""], ['IT서비스 접은 비케이탑스, 고철 판매로 흑자', ""오클레어 '스멜리', 백화점·호텔들이 찾는 화장실용 탈취·항균 스프레이"", '삼성이 200억 투자한 디엔에프 ""전구체 등 반도체 소재 국산화""', 'K바이오 작년 첫 무역수지 흑자'], [""'건설·부동산 전문' 법무법인 산하…이제는 종합 법률 로펌 꿈꾼다"", ""율촌, 'IP&Tech 부문' 출범"", '바른, 라이프운용에 자문', '""美·日 사례 파헤쳐""…태평양, 韓닛산 \'디젤게이트\' 선방'], ['경기도 재난지원금 또 모든 도민에 주나', '지방 낙후지역, 다시 태어난다', '부동산 4채 김현아, 결국 SH 사장 후보 사퇴', ""'반수생' 2배 늘어난 세 가지 이유"", '이번주 내내 폭염·소나기…전력수급 비상', ""'백신 새치기' 당진시 前 부시장 등 4명 검찰 송치""], [""5관왕 드레슬 '내가 바로 새 수영황제!'"", '골프 금메달 쇼플리…""할아버지·아버지 오랜 꿈 이뤘어요""', '0.01초 줄이는데 33년이 걸렸다', ""짝발 우상혁 24년의 벽' 뛰어넘다"", '허벅지 핏줄 터진 채 30점 꽂은 김연경', '완벽한 \'여서정\'으로 女체조 첫 메달…""이젠 아빠 이겨보고 싶어""', ""9회말 적시타 끝내준 '캡틴 김'""], [""김은영 초대전 '길을 묻다'…화폭에 담아낸 40가지 '마음의 모양'"", ""같은 시간 벌어진 연쇄 살인…심장 뛰게하는 '서늘한 긴장'"", '김은희 작가 ""액션보다 감정의 깊이 담아…내 작품 중 가장 어두운 이야기""', ""전통 수묵화의 '새로운 경지' 두 거장을 만나다""], [""안산·김제덕 '로빈후드' 화살, 박물관에 간다"", '원자력통제기술원장에 황용수', '양성평등교육진흥원장에 장명선 교수', ""'민청학련' 변호 맡은 1세대 인권변호사 강신옥 前 의원 별세"", '강형원 사진작가 ""한국 문화 세계에 알릴 사진 찍으러 전국 찾아다니죠""', '강명수 한국표준협회장 ITF 최고위원', '골프스타 김시우·오지현 ""결혼 전제로 교제""', '[한경에세이] 다시 협업을 준비해야 할 때'], ['[다산 칼럼] 조공제로 회귀하려는 중국', '[취재수첩] 언론중재법 찬성한 기자 출신 의원의 가짜뉴스', '[데스크 칼럼] BTS 단상, 콘텐츠 산업의 파워'], [""[천자 칼럼] 올림픽 스타들의 '부항 사랑'"", '[사설] 통신선 복구하자마자 대북 퍼주기에 한·미 훈련 미루자니', '[사설] 코로나 위기 뚫고 수출 사상 최대…믿을 건 기업뿐', ""[사설] 대선 앞두고 '복지급여' 대폭 인상…나라 곳간 누가 책임지나"", '[시론] 미·중 패권전쟁과 자본주의 4.0']]",20210802
1,한국경제,"[['1주택자 양도세 경우의 수만 189개…지키라는 稅法 맞나', ""스타트업 '투자 전쟁'…대기업도 줄섰다"", ""넷마블, 2조5000억 통 큰 베팅…'소셜카지노' 스핀엑스 인수"", '고위험 美·中 주식도 장기투자땐 안전자산', '달러보험 가입 까다로워진다…달러 월급 받아야 가능'], ['""캠퍼스도 못 밟아보고 졸업""…전문대 \'코로나 학번\'의 좌절', '화이자·모더나 가격 인상…""한국 내년 백신 예산 6조 웃돌 수도""', ""[그림이 있는 아침] 유영국 '작품'"", '방준혁의 야심…60억달러 소셜카지노 게임 시장 노린다'], [""창업멤버만 보고 200억 베팅…'제2 배민·토스' 찾는 투자금 6.7조"", '美 기술 스타트업도 역대급 투자유치…대형 펀드까지 가세', ""5만원만 있으면 '무신사' 주주…스타트업 개인투자자도 급증""], [""경기도 '100% 재난지원금', 문재인 정부는 안 막나, 못 막나…"", ""2년새 24배 복잡해진 '양도세 계산식'…세무사도 포기할 판"", '""20억 전세 살면 지원금 받고, 15억 집 있으면 못 받는다니…""'], [""日, 엔저에 '달러보험' 수요 폭발…대만, 전체 생명보험의 40% 차지"", '금리 인상 = 자산가격 조정?…과거 세번의 인상기, 집값 모두 올랐다', '달러보험 가입 까다로워진다…달러 월급 받아야 가능'], [""윤석열 '여의도 적응' 이재명 '反기업 지우기' 이낙연 '호남 굳히기'"", '""많이 가르쳐달라"" 몸 낮춘 윤석열…당내 광폭행보', ""경기도로 옮겨간 '李·李갈등'…재난지원금·分道 놓고 충돌"", ""與 잠룡들 '문재인 대통령 멘토' 쟁탈전"", ""與, 내주 의원총회 소집…'법사위 양보' 쟁점 전망"", '""與 언론규제법 강행…독재정권서 하던 짓""'], ['""3년 전 퇴직연금에 이것 담았다면…"" 80% 넘는 수익 \'거뜬\'', '나머지 30%는 무조건 저축성예금?…""안정적 수익내는 중·저위험상품도""', '""덩치 큰 펀드가 더 낫다""…운용 안정성 탄탄'], ['일손 부족한데 줄줄이 이직…기계음 줄어든 산단', '""신생·소멸기업 감소…산업 역동성 위축""', '재난지원금, 배달앱에서 쓸 수 있다', '""현대건설, 안전보건 관리 미흡""…고용부, 과태료 5.7억원 부과', '벌써 추석 물가 비상…이달 정부미 8만t 방출'], ['토스의 파격…""송금 수수료 평생 무료""', '피플펀드 ""마이데이터 활용 중금리 대출 늘릴 것""', ""페퍼저축은행 '녹색금융 대출', 6개월 만에 800억 돌파"", '기업은행, 2조 특판예금 쏜다'], ['中도 델타 변이 전국 확산…""우한 이후 최악""', ""'빚더미' 中 구이저우성 돈줄 된 마오타이"", '세계 집값 30년 만에 최대폭 상승…OECD 40개국 중 37곳 올랐다', '잭 도시가 이끄는 美 스퀘어, 33조원에 호주 핀테크 인수', '확진자 다시 10만명 넘은 美…""접종 충분…재봉쇄 없을 것""'], [""'10년 숙원' 이룬 신동빈…롯데, 5조 인도네시아 화학단지 짓는다"", '기아 전기차 EV6, 한 번 충전에 475㎞', 'KG동부제철, 당진공장에 업계 최대 ESS 구축', '반도체 1위 탈환…웃지 못하는 삼성전자', '휴대용TV·마이마이·애니콜 등 삼성, 임직원 기부 옛 제품 공개', '김윤 ""삼양 미래 먹거리 의료·친환경 소재""', '한국타이어, ESG위원회 신설'], ['중개사 반발에…네이버, 허위매물 방지책 포기', ""한컴, 2세 승계 '착착'…신임 대표에 김연수 부사장"", '""TV 채널은 여전히 블루오션…SK콘텐츠 삼각편대 만들 것""', ""LG, 'CES 혁신상' 탄 게임용 모니터 출시"", '""코로나로 데이터 유출 피해액 사상 최고""', '개관 1주년 맞은 프론트원, 51개 스타트업 436억 유치'], [""2,3代 물려받은 '명문 장수中企' 대기업·해외에서 줄줄이 찾는다"", '진승현 랩지노믹스 대표 ""15분 내 감염 여부 알 수 있는 키트 만들 것""', ""'원액기 업체' 휴롬, 과일유통사업 확대"", '이오플로우-유엑스엔 손잡고 웨어러블 인공췌장 기기 개발', '중기부 ""공정 자동화 도와 기업 해외유출 막겠다""'], ['전통 패션 강자들의 반격…""온라인몰로 승부""', '""오늘도 집에서 짠~""…10명 중 8명이 홈술족', ""CJ온스타일, 해외 패션 '중무장'"", ""멍냥이 위한 '편의점표 보양식' 나왔다""], [""SK바사 '화려한 부활'…상장후 최고가 경신"", '크래프톤, 청약 첫날 1.8조 몰려', ""HMM 덮친 '파업 공포'…4만원선도 붕괴"", '롯데푸드·신세계푸드, 영업이익 급증'], [""네이버·카카오 빼곤…'BBIG7' 이름값 못하네"", '레이 달리오 ""中투자 여전히 유망…중국식 자본주의 이해해야""', '고객 예탁금 75조원, 하루 만에 9조원 급증', '유리자산운용, 年 5% 수익…글로벌우량주+단기채펀드 출시', '상장 나선 롯데렌탈 ""모빌리티 플랫폼 선두 될 것""', ""정부기금·퇴직연금·학교재단, '사모펀드 출자 금지' 완화될 듯"", ""골프株, MZ세대 열풍 타고 '굿샷'"", '[알립니다] 제4회 한국 지방자치단체 회계대상'], [""공매도 재개 3개월,외국인물량 2배로…LG디스플레이·신풍제약 등 '정밀 타격'""], [""문래동 '노후 3인방' 재건축 사업 속도낸다"", 'LH, 이달 공공분양·임대주택 5252가구 공급', '한국토지신탁, 신정동 수정 재건축 수주', ""동문건설, 프리미엄 브랜드 '디 이스트'"", '서울 아파트 거래 줄었지만…10건 중 4건, 2030세대가 샀다', ""'한강 조망' 응봉1구역 건축심의 통과""], [""부산 해안가 '7개 다리' 관광 브랜드 된다"", ""대구 '이건희 컬렉션' 특별전…한 달 만에 관람객 2만명 돌파"", '""댐 하류지역 수해 예방…지천 제방관리에 달렸다""', '정부 지진조사 결과에 반발하는 포항', '부산시, 입원아동 돌봄서비스', '구미전자정보기술원, 메이커스 주관', '울산 북구청, 송정문화센터 건립', '울산시, 문수체육관 완공', '신동헌 시장 ""남한산성~팔당 둘레길 조성, \'관광도시\' 광주 기틀 다질 것""', '인천, 항만·산단·공업지대 기반시설 정비 추진', '서천 판교 근대역사공간, 등록문화재 된다', '경기, 전국민 정책 아이디어 공모', '인천TP, 디지털 뉴딜 中企 모집', '충남, 고용 우수기업 선정해 지원', '무인헬기·드론이 농약 살포…태안, 농촌 일손부족 해소'], [""지하철역 이름 '쩐의 전쟁'…역삼역 별칭 최소 2억원대"", '[포토] 金수박…한 달 새 가격 35% 치솟아', ""변협, 4일부터 '로톡 변호사' 징계 나선다"", '[단독] LG, 그룹 모태 \'구인회상점\' 이름 지켰다…法, ""아무나 쓸 수 없어""', '대법 ""의대생 사망 배상금, 의사 소득이 기준""', '정부, 보호시설 거주 장애인 자립 도와', '경찰 ""광복절 집회 원천 차단""'], [""9초94→9초84→9초80…'포스트 우사인 볼트' 대기록"", '허리 철심 박고도 포기 안한 신재환…결국 가장 높이 날았다', '""일본인 90% 올림픽 시청""…바흐 IOC 위원장 또 실언', ""박인비·리디아 고·펑산산 '리우 리턴매치'"", ""배드민턴 집안싸움…승자도 패자도 '웃음꽃'"", ""야구 '이스라엘戰 대승'…4일 준결승은 한·일전""], ['""선·악 벗어난 인간 본성…새 \'나부코\' 선보일 것""', '마이클 리 ""노래만 하는 콘서트 아니라 쇼 같은 공연 선사하겠다""', ""혼례복·가구·그림으로…궁궐에서 만나는 '꽃의 왕' 모란"", '""사군자처럼…코로나 우울 이겨내길""'], [""'인도 스포츠의 스승' 떠오른 박태상 코치"", '비자코리아 사장 패트릭 스토리', '뉴스통신진흥회 감사에 홍성완 씨', '강경화 이화여대 석좌교수行 전망', '대산문화재단, 문학 번역출판 지원', '장명선 양성평등교육진흥원장 취임', '덕성여대 총장직무대리에 김경묵 교수', '정진완 회장 ""도쿄패럴림픽 \'메달·안전\' 두마리 토끼 잡을 것""', '새 이천선수촌장에 박종철 선임', ""남해 빵식이 아재·28년 미용 봉사자 'LG 의인상'"", ""환갑 맞은 오바마…코로나에도 대규모 파티 '논란'"", '[제25기 하림배 프로여자국수전] 버티는 白', '[한경에세이] 진리는 보자기 안에 있다'], ['[경제포커스] 동그란 네모를 그린다는 경제성장론', '[특파원 칼럼] 공산주의로 돌아가는 중국', ""[취재수첩] 기업부담 키우는 '오락가락' 해고 판결""], [""[천자 칼럼] 中의 빅테크 '군기 잡기'"", '[사설] ""도둑질 말고 어디서 2억 구하냐"" 전세난민의 절규', '[사설] 문체부도 ""과도하다""는 언론 징벌적 손배법 철회해야', '[사설] ""위기를 기회로"" 영업이익 1조 클럽 100개로 늘려보자', '[이건호 칼럼] 빅픽처 못 그리는 삼성'], ['과감한 M&A·신사업으로…코로나 위기 파고 넘어선다'], ['최대 실적 올린 韓철강, 친환경 기술 확보 총력'], ['LS, 스마트 공장으로 에너지 사용 60% 감축…""디지털 역량 강화""', ""한화, 태양광·수소에 5년간 9조 그린에너지 육성 '통큰 투자'"", '포스코, 리튬 추출 시설 확대…""친환경 소재 대표기업으로""', '삼성전자, 3년내 M&A·내년 평택 3라인 완공…""한발 앞서 미래 준비""'], [""GS, 드론 배송·미래형 주유소…'디지털 전환' 박차"", '코오롱, 고열에도 끄떡없는 슈퍼섬유 생산 2배로 늘린다', '롯데, 자율주행버스·수소·배터리 등 그룹 포트폴리오 고도화 나서', '현대자동차·기아, 로봇 기술 접목해 미래 모빌리티 가속'], [""현대모비스, 자율주행·전기차 핵심 부품기술 투자 '가속'"", 'KT, 통신 넘어 콘텐츠·로봇·핀테크로 영토 확장', ""LG, 배터리·전장사업 경쟁력 '업그레이드'"", 'SK, ESG 중심 4대 핵심사업 집중투자'], ['공동투자 확대 나선 큰손들', '매출 100억 간편식 제조사 매물로', '맥쿼리자산운용 ""임팩트 인프라 투자 관심 가져야""', ""자회사 정리 나선 YG엔터 'M&A 잔혹사'""]]",20210803
